{
  "id": "01928374-0002-7000-8000-000000000003",
  "prior_receipt": {
    "id": "01928374-0001-7000-8000-000000000002",
    "content_hash": "sha256:23f05ae86be1104a88cb304b813df25908ff1d217d5da538d08e78e4ea4f49ec"
  },
  "sequence": 2,
  "runtime": {
    "implementation": "ReplayOS",
    "version": "1.0.0",
    "instance_id": "urn:uuid:01928374-0000-7000-8000-000000000001",
    "binary_hash": "sha256:e3b0c44298fc1c149afbf4c8996fb92427ae41e4649b934ca495991b7852b855",
    "configuration_hash": "sha256:a7ffc6f8bf1ed76651c14756a061d662f580ff4de43b49fa82d80a4b80f8434a",
    "signing_key": {
      "key_id": "did:key:z6MkhdxRrX8GXyW2x9ArDxay7ioxmWr95Pfzr4Dmm7GJHuF1",
      "public_key_hash": "sha256:1b64c04b88e38a56e442473bc3c8c1206b744ce0f070d9a2be275af73beea467",
      "key_version": 1,
      "validity_receipt_ref": {
        "id": "01928374-0000-7000-8000-000000000000",
        "content_hash": "sha256:7ec1f57d9053774d7c595da90ab29102a3c8e5f8cd662465844a8d94ef0042f9"
      }
    }
  },
  "observed_at": "2026-08-04T00:00:02Z",
  "time_evidence": {
    "type": "LOCAL_CLOCK",
    "reference": null
  },
  "instrument_id": "008",
  "type": "archive",
  "input_hash": "sha256:446ccf983d1c69b4a880138b2e50f93bfb5a2578c5b422f6bed5d9fb90b76cb2",
  "output_hash": "sha256:9121a6de830d0b1b396522f7d6aa1736bf7e80baa5a0bcda6b645c13706457bc",
  "status": "OK",
  "evidence_class": "UNVERIFIED",
  "anchor": {
    "scheme": "sha256",
    "digest": "sha256:febd433482ec79b4c180a4daf5866bf98b0b4984ff5bd056137d0fb7ea2b7b47",
    "location": null,
    "inclusion_proof": {
      "type": "none",
      "data": null
    }
  },
  "verification_context": {
    "profile": "RAA-URP-1",
    "context_hash": "sha256:20d85fb6608c99db24c778f8eeeac7d42b7bf6604eb6e97bddb17f1fe897036c"
  },
  "terminal": true,
  "metadata": {
    "synthetic_test_vector": true,
    "vector_id": "003-terminal-chain",
    "event": "CHAIN_TERMINATION",
    "prior_vector": "002-standard-chain",
    "declared_result": "CHAIN_TERMINATED"
  },
  "signature": "ed25519:base64:TpCUPYsN1+5g33ZRnFfbM+gCnAtqv+FVowBBdswHHXAckadmDJDzjfyeU/TopjF+Xk7W96iwGw+gsqKOXc9DAQ=="
}
